{
  "action_type": "registry_mutation",
  "agent_id": "example-agent",
  "agent_reason": "request registry mutation",
  "dry_run": false,
  "evidence_refs": [],
  "parameters": {},
  "request_id": "05-registry-change-high-risk:request",
  "requested_at": "2026-01-01T00:00:00Z",
  "requested_effect": "change one synthetic registry value",
  "targets": [
    {
      "identifier": "05-registry-change-high-risk:target",
      "metadata": {
        "synthetic": true
      },
      "observed_state": {
        "exists": true,
        "is_reparse_point": false,
        "target_type": "registry_key"
      },
      "path": "HKCU:\\Software\\ExampleGuardKey",
      "target_type": "registry_key"
    }
  ]
}
