{
  "action_type": "read_metadata",
  "agent_id": "example-agent",
  "agent_reason": "read-only audited request",
  "dry_run": false,
  "evidence_refs": [],
  "parameters": {},
  "request_id": "11-audit-chain:request",
  "requested_at": "2026-01-01T00:00:00Z",
  "requested_effect": "read synthetic metadata",
  "targets": [
    {
      "identifier": "11-audit-chain:target",
      "metadata": {
        "synthetic": true
      },
      "observed_state": {
        "exists": true,
        "is_reparse_point": false,
        "target_type": "directory"
      },
      "path": "C:\\Temp",
      "target_type": "directory"
    }
  ]
}
