{
  "action_type": "delete_temp_file",
  "agent_id": "example-agent",
  "agent_reason": "request a bounded mutation",
  "dry_run": false,
  "evidence_refs": [],
  "parameters": {},
  "request_id": "02-temp-clean-require-confirmation:request",
  "requested_at": "2026-01-01T00:00:00Z",
  "requested_effect": "remove one synthetic temp file",
  "targets": [
    {
      "identifier": "02-temp-clean-require-confirmation:target",
      "metadata": {
        "synthetic": true
      },
      "observed_state": {
        "exists": true,
        "is_reparse_point": false,
        "mtime_ns": 100,
        "sha256": "aaaaaaaaaaaaaaaaaaaaaaaaaaaaaaaaaaaaaaaaaaaaaaaaaaaaaaaaaaaaaaaa",
        "size_bytes": 128,
        "target_type": "file"
      },
      "path": "C:\\Temp\\example.tmp",
      "target_type": "file"
    }
  ]
}
